date,client_name,after_date,raw_line
2026-01-27,"DMYTRIIEVA, TETIANA","CLINIC, GENERAL PHYSIO- SH AND HAND ALBERTA INJURY","DMYTRIIEVA, TETIANA 2026-01-27 CLINIC, GENERAL PHYSIO- SH AND HAND ALBERTA INJURY"
2026-01-27,"MANAGEMENT INC.FRANCIS, DWIGHT","PAPPU, ANNICE B CASSIEA SECTION B PHYSIO ALBERTA INJURY","MANAGEMENT INC.FRANCIS, DWIGHT 2026-01-27 PAPPU, ANNICE B CASSIEA SECTION B PHYSIO ALBERTA INJURY"
2026-01-27,"MANAGEMENT INC.KENTON, MARYLOU","PAPPU, ANNICE B CASSIEA PHYISO 2026 - NECK & SHOULDER ALBERTA INJURY","MANAGEMENT INC.KENTON, MARYLOU 2026-01-27 PAPPU, ANNICE B CASSIEA PHYISO 2026 - NECK & SHOULDER ALBERTA INJURY"
2026-01-27,"MANAGEMENT INC.LAMOUCHE, BRENT","PAPPU, ANNICE B CASSIEA MVA- PEDESTRIAN ALBERTA INJURY","MANAGEMENT INC.LAMOUCHE, BRENT 2026-01-27 PAPPU, ANNICE B CASSIEA MVA- PEDESTRIAN ALBERTA INJURY"
2026-01-27,"MANAGEMENT INC.WILSON, KAREN","PAPPU, ANNICE B CASSIEA MASSAGE ALBERTA INJURY","MANAGEMENT INC.WILSON, KAREN 2026-01-27 PAPPU, ANNICE B CASSIEA MASSAGE ALBERTA INJURY"
